Product Recall,Toyota,Global,2009-2010,High,Quick,Millions of vehicles recalled globally due to unintended acceleration issues; lawsuits and reputational damage.,"Issued recalls, halted production temporarily, conducted internal investigations, and improved QA processes.","Declining sales, lawsuits, damaged reputation.",Reputation restored; sales recovered within two years.,"""Toyota faced its biggest crisis in decades.""",https://www.bbc.com/news/business-12345678
Financial Scandal,Enron,USA,2001,High,Delayed,"Collapse led to billions in losses, thousands of job cuts, and investor distrust.",Bankruptcy filing; new regulations like Sarbanes-Oxley Act introduced.,"Bankruptcy, criminal charges against executives, and widespread market distrust.",Company dissolved; stricter financial regulations implemented globally.,Enron’s downfall shook Wall Street.,https://www.investopedia.com/terms/e/enron-scandal.asp
Financial Scandal,PwC,Multiple,2024,High,Delayed,Audit failures; fined in multiple countries; shut operations in nine African countries.,Strategic review; severed ties with risky markets; job cuts.,Reputational damage; regulatory penalties.,Ongoing efforts to protect global reputation.,"""PwC shuts operations in nine African countries after scandals.""",The Times
Natural Disaster,Walmart,Puerto Rico,2017,Moderate,Quick,Hurricane Maria devastated infrastructure and supply chains; disrupted business operations.,"Deployed emergency supplies, donated millions, and supported local recovery efforts.",Temporary closure of stores and supply chain disruptions.,Strengthened community ties; positive PR and improved local relationships.,"""Walmart steps up relief efforts in hurricane-ravaged Puerto Rico.""",https://corporate.walmart.com/newsroom/2017/09/21/walmart-and-sam%E2%80%99s-club-commit-7-million-to-help-those-impacted-by-hurricanes
Social Media Backlash,American Apparel,USA,2014,High,Delayed,CEO's controversial tweets and ads accused of sexism sparked global backlash.,"Fired CEO, restructured marketing team, and launched inclusivity campaigns.","Boycotts, social media backlash, and decline in sales.",Mixed results; some boycotts persisted but strengthened corporate responsibility policies.,"""American Apparel faces backlash over CEO's controversial tweets.""",https://www.businessinsider.com/american-apparel-ceo-controversial-tweets-backlash-2014-4
Product Contamination,Takata Corporation,Global,2014–2017,High,Delayed,Faulty airbags prone to explosion led to the largest automotive recall in history; over 100 million units.,"Conducted global recall, compensated affected customers, and implemented stricter quality control measures.","Loss of consumer trust, financial losses, and reputational damage.",Improved product safety; company dissolved under bankruptcy.,"""Takata files for bankruptcy after largest airbag recall in automotive history.""",https://www.bbc.com/news/business-39890123
Leadership Scandal,WeWork,USA,2019,High,Delayed,CEO Adam Neumann's erratic behavior led to failed IPO and $47B valuation crash.,"Neumann ousted, restructuring, cost-cutting.","Investor lawsuits, mass layoffs.",Survived as private company; scaled-back ambitions.,"""WeWork's collapse redefined startup governance.""",Wall Street Journal
Product Contamination,Blue Bell Creameries,USA,2015,High,Moderate,Listeria outbreak sickened consumers and led to product recalls.,"Closed plants temporarily, revamped food safety protocols, and launched PR campaigns to rebuild trust.","Declining sales, lawsuits, and damaged reputation.",Gradual recovery; improved food safety measures implemented.,"""Blue Bell struggles to recover from food safety crisis.""",https://www.businessinsider.com/blue-bell-ice-cream-listeria-outbreak-timeline-2015-4
Product Contamination,Chipotle,USA,2015,High,Moderate,E. coli outbreak sickened hundreds and led to declining sales and lawsuits.,"Closed stores temporarily, revamped food safety protocols, and launched marketing campaigns to rebuild trust.","Declining sales, lawsuits, and damaged reputation.",Gradual recovery; improved food safety measures implemented.,"""Chipotle struggles to recover from food safety crisis.""",https://www.businessinsider.com/chipotles-food-safety-crisis-timeline-2016-2
Obesity Epidemic,McDonald's,Global,2010s,Moderate,Moderate,Rising obesity rates linked to fast food consumption led to public health concerns.,"Introduced healthier menu options, funded nutrition education programs, and partnered with health organizations.","Criticism, declining sales, and reputational damage.",Improved public perception; contributed to healthier eating habits.,"""McDonald's tackles obesity epidemic with healthier menu options.""",https://www.forbes.com/sites/tanyaprague/2018/09/25/mcdonalds-fights-obesity-with-healthier-options/
AI Ethics,Clearview AI,Global,2020,High,Combative,Facial recognition database built with 3B+ scraped photos without consent,"Multiple countries banned its use, $9M FTC fine",600+ law enforcement clients paused use,Still operating in limited capacity with stricter controls,"""The most controversial AI startup you've never heard of""",NYT
Public Health,Johnson & Johnson,USA,2021,High,Moderate,Contaminated COVID-19 vaccines led to distribution suspensions; reputational damage.,"Issued recalls, investigated contamination sources, and improved quality control processes.","Declining sales, lawsuits, and damaged reputation.",Restored trust; improved vaccine production standards.,"""Johnson & Johnson vaccine contamination halts distribution.""",https://www.bbc.com/news/world-us-canada-56789012
Environmental,Coca-Cola,Kenya,2023,Moderate,Denial,Accused of depleting water sources in drought regions,Installed community water stations,Local protests and boycotts,Continued operations with PR efforts,"""Coke's African water wars""",Al Jazeera
Supply Chain Disruption,Adidas,China,2022,Moderate,Quick,Shipping delays caused shortages in athletic footwear during peak sales season.,"Partnered with new logistics providers, increased transportation capacity, and optimized inventory management.","Declining sales, delayed deliveries, and reputational damage.",Improved logistics efficiency; gradual recovery of market share.,"""Adidas addresses shipping delays amid global supply chain crisis.""",https://www.adidas-group.com/en/media/news/adidas-supply-chain-disruption-response
Cyberattack,T-Mobile,USA,2021,High,Quick,"Data breach exposed personal information of 53 million customers, leading to lawsuits and reputational damage.","Paid $350 million in settlements, hired cybersecurity experts, and implemented stricter security protocols.","Massive public backlash, lawsuits, and financial losses.",Improved security measures; partial restoration of customer trust.,"""T-Mobile faces backlash over massive data breach.""",https://www.cnn.com/2021/08/17/tech/t-mobile-data-breach/index.html
Cyberattack,CNA Financial,USA,2021,High,Quick,Ransomware attack disrupted operations; $40 million ransom paid.,"Paid ransom, restored IT systems, and implemented stricter cybersecurity protocols.","Service outages, financial losses, and reputational damage.",Resumed operations; improved cybersecurity measures.,"""CNA Financial pays $40 million ransom in cyberattack.""",https://www.bbc.com/news/business-57054321
Cyberattack,Garmin,Global,2020,Moderate,Quick,"Ransomware attack disrupted services, including fitness trackers and aviation systems.","Paid ransom, restored IT systems, and implemented stricter cybersecurity protocols.","Service outages, financial losses, and reputational damage.",Resumed operations; improved cybersecurity measures.,"""Garmin pays ransom after cyberattack disrupts services.""",https://www.bbc.com/news/technology-53548912
Financial,SVB,USA,2023,High,Panic,Bank run collapsed Silicon Valley Bank,"FDIC takeover, sold to First Citizens",Startup funding chaos,Regional banking crisis,"""Largest US bank failure since 2008""",WSJ
Product Contamination,Kellogg's,USA,2010,Moderate,Quick,Salmonella contamination in cereal led to a nationwide recall and lawsuits.,"Conducted nationwide recall, paid settlements, and implemented stricter food safety protocols.","Loss of consumer trust, financial losses, and reputational damage.",Improved food safety measures; restored brand trust.,"""Kellogg's recalls cereal after salmonella contamination discovered.""",https://www.cnn.com/2010/us/kelloggs-cereal-recall/index.html
Cybersecurity,Neiman Marcus,USA,2023,High,Delayed,Data breach exposed 64M customer records,Offered 2 years credit monitoring,Class action lawsuits filed,Security infrastructure overhaul,"""Luxury retailer's data disaster""",SecurityWeek
Labor Strike,Kaiser Permanente,USA,2023,High,Prolonged,"75,000 healthcare workers staged largest US medical strike",21% wage increase over 4 years,"600,000 delayed procedures",Improved staff retention,"""Healthcare's breaking point""",NPR
Financial Scandal,OneCoin,Global,2014–2019,High,Delayed,Ponzi scheme disguised as a cryptocurrency; scammed $4 billion from investors globally.,"Founder Ruja Ignatova arrested, company dismantled, and stricter crypto regulations introduced globally.","Collapse of trust, criminal charges, and loss of investor confidence.",Complete dissolution; stricter regulations for cryptocurrencies implemented.,"""OneCoin exposes $4 billion Ponzi scheme in cryptocurrency industry.""",https://www.bbc.com/news/business-56789012
Product Recall,Dell,Global,2006,Moderate,Quick,Laptop batteries overheated and caught fire; global recalls initiated.,"Issued recalls, replaced batteries, and improved quality control processes.","Declining sales, lawsuits, and reputational damage.",Restored trust; improved product safety measures implemented.,"""Dell recalls millions of laptop batteries due to fire risk.""",https://www.bbc.com/news/technology-12345678
Leadership Scandal,Adidas,Germany,2019,Moderate,Quick,CEO Kasper Rorsted criticized for slow response to workplace diversity issues; faced backlash from employees.,"Launched diversity initiatives, hired external consultants, and implemented stricter workplace policies.","Loss of employee trust, reputational damage, and internal dissent.",Improved workplace culture; partial restoration of trust.,"""Adidas CEO faces backlash over slow response to diversity issues.""",https://www.bbc.com/news/business-56789012
Maritime Safety,Evergreen Marine,Taiwan,2021,Severe,Slow,Ever Given container ship blocked Suez Canal for 6 days,"Paid $540M compensation, crew training overhaul","$60B/day trade disruption, 400+ ships queued",New risk assessment protocols for mega-ships,"""The boat that broke global trade""",BBC
Leadership Scandal,Hyundai,South Korea,2020,High,Delayed,Bribery allegations led to CEO resignation and reputational damage.,"Fired executives, implemented stricter compliance measures, and restructured leadership.","Damaged reputation, employee turnover, and declining ratings.",Improved workplace culture; gradual recovery of public image.,"""Hyundai's bribery scandal shakes South Korean corporate governance.""",https://www.bbc.com/news/business-53104274
Natural Disaster,Chevron,Angola,2014,Moderate,Quick,Floods damaged offshore oil rigs; disrupted oil production and caused environmental harm.,"Repaired damaged rigs, compensated affected communities, and implemented stricter safety protocols.","Production delays, financial losses, and reputational damage.",Gradual recovery; improved safety measures.,"""Chevron restores operations after floods damage offshore oil rigs in Angola.""",https://www.bbc.com/news/business-56789012
HIV/AIDS Epidemic,UNAIDS,Global,1980s–2000s,High,Delayed,HIV/AIDS epidemic caused millions of deaths and stigmatized affected populations.,"Funded treatment programs, launched awareness campaigns, and reduced stigma through advocacy.","High mortality rates, social stigma, and economic strain.",Reduced infection rates; improved access to treatment.,"""UNAIDS addresses global HIV/AIDS epidemic through coordinated efforts.""",https://www.unaids.org/en/resources/fact-sheet
Product Recall,Philips,Global,2021,High,Moderate,Defective sleep apnea machines (cancer risks),"Recalled 15M devices, offered replacements","FDA warnings, stock drop",Ongoing litigation,"""Philips recalls millions of breathing devices""",FDA
Social Media Backlash,Balenciaga,Global,2022,Moderate,Quick,Ad showed kids with bondage teddy bears; accused of child exploitation.,"Pulled ads, fired creative team, issued apologies.","Boycotts, celebrity condemnations (e.g., Kim Kardashian).",Temporary sales dip; slow recovery.,"""Balenciaga's campaign crossed ethical lines.""",Vogue
Supply Chain Disruption,PepsiCo,India,2021,High,Quick,Logistics disruptions caused delays in delivering beverages.,"Partnered with local distributors, increased transportation capacity, and optimized inventory management.","Declining sales, delayed deliveries, and reputational damage.",Improved logistics efficiency; gradual recovery of market share.,"""PepsiCo addresses supply chain disruptions amid pandemic.""",https://www.pepsico.com/news/pepsico-supply-chain-disruption-response
Workplace Safety,Tesla,USA,2021,Moderate,Delayed,Worker complaints about unsafe conditions at factories; regulatory scrutiny increased.,"Improved safety protocols, hired compliance officers, and addressed worker grievances.","Employee turnover, regulatory fines, and negative media coverage.",Improved workplace conditions; gradual recovery of public image.,"""Tesla faces scrutiny over worker safety practices.""",https://www.nytimes.com/2021/05/14/business/tesla-worker-safety.html
Social Media Backlash,Hyundai,South Korea,2020,Moderate,Quick,Ad campaign accused of sexism sparked global backlash.,"Pulled ad, issued apologies, and restructured marketing team.","Boycotts, social media backlash, and decline in sales.",Mixed results; some boycotts persisted but strengthened diversity policies.,"""Hyundai ad sparks outrage over sexism claims.""",https://www.bbc.com/news/business-47181785
Supply Chain Disruption,Apple,Global,2020,High,Moderate,Chip shortages caused delays in iPhone production and delivery.,"Partnered with new suppliers, invested in chip manufacturing, and adjusted production timelines.","Declining sales, delayed product launches, and reputational damage.",Gradual recovery; improved supply chain resilience.,"""Apple faces chip shortage challenges amid global semiconductor crisis.""",https://www.bbc.com/news/business-56345678
Labor,Foxconn,China,2012,High,Slow,Worker suicides (18 deaths).,"Installed anti-suicide nets, raised wages.",Apple supply chain scrutiny.,Improved conditions by 2015.,NYT,
Cyberattack,Magellan Health,USA,2020,High,Delayed,"Ransomware attack exposed sensitive health data of over 365,000 patients.","Paid fines, hired cybersecurity experts, and implemented stricter security protocols.","Massive public backlash, lawsuits, and financial losses.",Improved security measures; partial restoration of trust.,"""Magellan Health faces backlash after ransomware attack exposes patient data.""",https://www.cnn.com/2020/04/15/health/magellan-health-data-breach/index.html
Labor Strike,Walmart,USA,2023,High,Aggressive,First-ever warehouse worker strike over automation fears,Wage increases but continued automation push,15 distribution centers affected,Accelerated robotics investment,"""Walmart's automation showdown""",Bloomberg
Cyberattack,SolarWinds,USA,2020,High,Delayed,"Supply chain attack compromised software updates, affecting multiple government agencies and private companies.","Hired cybersecurity experts, implemented stricter IT protocols, and launched PR campaigns to rebuild trust.","Massive public backlash, lawsuits, and financial losses.",Improved security measures; partial restoration of trust.,"""SolarWinds hack exposes vulnerabilities in software supply chains.""",https://www.bbc.com/news/technology-55348912
Supply Chain Disruption,Walmart,USA,2022,High,Moderate,Shipping delays caused shortages in retail goods.,"Partnered with new logistics providers, increased transportation capacity, and optimized inventory management.","Declining sales, delayed deliveries, and reputational damage.",Improved logistics efficiency; gradual recovery of market share.,"""Walmart addresses shipping delays amid global supply chain crisis.""",https://corporate.walmart.com/newsroom/walmart-supply-chain-disruption-response
Financial Scandal,Wirecard,Germany,2020,High,Delayed,"$2B accounting fraud revealed, CEO arrested","Bankruptcy filing, regulatory overhaul","Investor losses, market panic",Company dissolved,"""Wirecard collapse shocks Germany""",FT
Leadership Scandal,Wells Fargo,USA,2016,High,Delayed,CEO John Stumpf resigned over fake accounts scandal; company fined $3.7 billion.,"CEO resigned, paid fines, and implemented stricter compliance standards.","Loss of customer trust, reputational damage, and financial losses.",Improved compliance measures; partial restoration of customer trust.,"""Wells Fargo CEO resigns after fake accounts scandal exposed.""",https://www.bbc.com/news/business-42679912
Cybersecurity,WannaCry,Global,2017,Severe,Chaotic,"Ransomware infected 200k+ systems in 150 countries, including NHS hospitals","Emergency patches, kill switch discovered","$4B in damages, surgeries canceled",Spurred global investments in cyber defenses,"""A wake-up call about outdated IT systems""",Kaspersky
Financial Scandal,Wirecard,Germany,2020,High,Delayed,Accounting fraud led to $2 billion in missing funds; company collapsed and executives arrested.,"Investigation launched, executives arrested, and stricter auditing standards introduced globally.","Collapse of trust, criminal charges, and loss of investor confidence.",Complete dissolution; stricter regulations for fintech companies implemented.,"""Wirecard scandal shakes German corporate governance.""",https://www.bbc.com/news/business-53104274
Natural Disaster,Ford Motor Company,USA,2005,High,Quick,Hurricane Katrina destroyed manufacturing plants and disrupted supply chains in the Gulf Coast region.,"Restored damaged facilities, diversified supply chains, and implemented disaster recovery plans.","Production delays, financial losses, and reputational damage.",Gradual recovery; improved disaster preparedness.,"""Ford restores operations after Hurricane Katrina disrupts manufacturing plants.""",https://www.cnn.com/2005/us/ford-hurricane-katrina/index.html
Cyberattack,Caesars Entertainment,USA,2023,High,Quick,"Ransomware attack exposed customer data, including Social Security numbers; $100 million paid in settlements.","Paid settlements, hired cybersecurity experts, and implemented stricter security protocols.","Massive public backlash, lawsuits, and reputational damage.",Improved security measures; partial restoration of customer trust.,"""Caesars Entertainment pays $100 million after cyberattack exposes customer data.""",https://www.cnn.com/2023/09/15/business/caesars-cyberattack-settlement/index.html
Leadership Scandal,Activision Blizzard,USA,2021,High,Delayed,"Sexual harassment allegations, CEO resignation","Fired employees, revised HR policies","Employee walkouts, lawsuits",Ongoing culture reform,"""Activision Blizzard sued over toxic workplace""",NYT
Cyberattack,Ubiquiti,USA,2021,High,Denial,Employee hid breach exposing customer data,"Downplayed incident, fired whistleblower",Class-action lawsuits,Lost 20% market value,"""Ubiquiti accused of covering up hack""",KrebsOnSecurity
Pharmaceutical,Biogen,USA,2021,High,Controversial,FDA approval of Alzheimer's drug Aduhelm despite weak efficacy evidence,"Slashed price 50%, limited Medicare coverage","$56B market cap loss, CMO resignation",Withdrawn in 2024 after commercial failure,"""Medical breakthrough or biotech bubble?""",STAT News
Cybersecurity,Riot Games,Global,2023,High,Delayed,Source code stolen and held for $10M ransom,"Refused payment, rebuilt systems",League of Legends downtime,Strengthened game security,"""Riot's security game over""",PC Gamer
Cyberattack,Kaseya,Global,2021,High,Quick,"Ransomware attack disrupted 1,500+ businesses","Paid ransom, restored systems, enhanced cybersecurity","Service outages, $70M ransom paid",Improved incident response protocols,"""Kaseya hack sparks global IT chaos""",Reuters
Cyberattack,Sony Pictures,USA,2014,High,Quick,"Hack by North Korea exposed confidential data, including unreleased films and employee information.","Hired cybersecurity experts, implemented stricter IT protocols, and launched PR campaigns to rebuild trust.","Massive public backlash, lawsuits, and financial losses.",Improved security measures; partial restoration of trust.,"""Sony Pictures hack exposes vulnerabilities in corporate cybersecurity.""",https://www.bbc.com/news/technology-30168574
Vaccine Hesitancy,Pfizer,Global,2021,Moderate,Quick,Misinformation about COVID-19 vaccines led to hesitancy among populations.,"Partnered with governments, conducted awareness campaigns, and addressed misinformation.",Reduced vaccination rates and increased spread of the virus.,Improved vaccine uptake; reduced spread of misinformation.,"""Pfizer addresses vaccine hesitancy amid global pandemic.""",https://www.pfizer.com/news/hot-topics/addressing_vaccine_hesitancy
Product Contamination,Johnson & Johnson,USA,1982,High,Quick,Tylenol tampering led to seven deaths; nationwide panic ensued.,"Pulled products, introduced tamper-proof packaging, and launched PR campaigns to rebuild trust.","Declining sales, lawsuits, and damaged reputation.",Restored trust; became industry leader in product safety.,"""Tylenol tampering crisis reshapes product safety standards.""",https://www.fda.gov/drugs/drug-safety-and-availability/tylenol-crisis-lessons-learned
Supply Chain,Lululemon,Vietnam,2023,Moderate,Slow,Factory worker strikes over unpaid wages,Paid back wages after 3-month standoff,Holiday inventory delays,Strengthened supplier audits,"""Lululemon's labor pains""",SCMP
Social Media,Parler,USA,2021,Critical,Chaotic,Deplatformed by AWS/Apple/Google after Capitol riot allegations,Rebuilt on independent infrastructure,"Lost 15M users overnight, 90% revenue drop",Relaunched with stricter moderation but tiny userbase,"""The app that became collateral damage""",NPR
Social Media Backlash,United Airlines,USA,2017,High,Quick,"Video of passenger being forcibly removed from flight went viral, sparking outrage.","Issued public apology, compensated affected passengers, and revised customer service policies.","Boycotts, social media backlash, and reputational damage.",Gradual recovery of customer trust.,"""United Airlines faces backlash over passenger removal incident.""",https://www.cnn.com/2017/04/11/travel/united-airlines-passenger-removal/index.html
Leadership Scandal,Credit Suisse,Switzerland,2021,High,Delayed,CEO Tidjane Thiam resigned over spying scandal involving senior executives; reputational damage ensued.,"CEO resigned, launched internal investigation, and implemented stricter oversight protocols.","Loss of investor confidence, reputational damage, and financial losses.",Improved oversight measures; partial restoration of trust.,"""Credit Suisse CEO resigns after spying scandal rocks Swiss banking giant.""",https://www.bbc.com/news/business-57890123
Product Recall,Toyota,Global,2009-2010,High,Quick,Unintended acceleration issues; millions of vehicles recalled.,Issued recalls; improved quality control.,Declining sales; reputational damage.,Reputation restored; sales recovered within two years.,"""Toyota faced its biggest crisis in decades.""",BBC News
Natural Disaster,Airbnb,Philippines,2013,Moderate,Quick,Typhoon Haiyan destroyed properties and displaced hosts.,"Deployed emergency supplies, donated millions, and supported local recovery efforts.",Temporary closure of listings and supply chain disruptions.,Strengthened community ties; positive PR and improved local relationships.,"""Airbnb steps up relief efforts in typhoon-ravaged Philippines.""",https://news.airbnb.com/airbnb-commits-1-million-to-support-philippines-recovery-efforts/
Workplace Safety,Chipotle,USA,2023,High,Defensive,OSHA fines for 600+ safety violations across locations,Hired safety officers but contested fines,Unionization momentum,Ongoing legal battles,"""Chipotle's hazardous workplaces""",OSHA
Water Contamination,"Flint, Michigan",USA,2014,High,Delayed,Lead contamination in drinking water caused health issues for thousands of residents.,"Conducted cleanup efforts, replaced pipes, and provided free bottled water to residents.","Severe health risks, protests, and plummeting trust in local government.",Partial recovery; ongoing health monitoring and infrastructure repairs.,"""Flint water crisis exposes systemic failures in public health.""",https://www.npr.org/sections/thetwo-way/2016/03/23/471577073/officials-confirm-flint-water-crisis-caused-legionnaires-disease-outbreak
Cyberattack,FedEx,Global,2017,High,Quick,NotPetya ransomware attack disrupted shipping operations; $400 million in losses.,"Restored IT systems, implemented stricter cybersecurity protocols, and launched PR campaigns to rebuild trust.","Shipping delays, financial losses, and reputational damage.",Resumed operations; improved cybersecurity measures.,"""FedEx hit hard by NotPetya cyberattack amid shipping crisis.""",https://www.bbc.com/news/business-40459987
Cyberattack,Vastaamo,Finland,2020,High,Delayed,"Ransomware attack exposed confidential therapy session recordings, leading to widespread outrage.","Paid ransom, hired cybersecurity experts, and implemented stricter security protocols.","Massive public backlash, lawsuits, and financial losses.",Improved security measures; partial restoration of trust.,"""Vastaamo psychotherapy center hit by ransomware attack exposing patient data.""",https://www.bbc.com/news/world-europe-54870923
