Cyberattack,Target,USA,2013,High,Delayed,Data breach exposed 40 million credit card accounts; loss of customer trust.,"Offered free credit monitoring, hired cybersecurity experts, and enhanced security systems.","Massive public backlash, lawsuits, and financial losses.",Improved security measures; partial restoration of customer trust.,"""Target breach costs company millions and damages reputation.""",https://www.cnn.com/2014/03/13/business/target-data-breach-costs/index.html
Environmental,Dow Chemical,India,1984,High,Delayed,"Bhopal gas tragedy caused over 15,000 deaths and long-term health issues; legal battles ensued.","Paid $470 million in compensation, conducted cleanup efforts, and invested in safer chemical practices.","Severe environmental harm, legal battles, and plummeting stock prices.",Partial recovery; ongoing environmental challenges remain.,"""Bhopal gas tragedy devastates Indian communities.""",https://www.theguardian.com/environment/2014/dec/02/bhopal-gas-tragedy-30-years-later
Environmental,Exxon,Alaska,1989,High,Delayed,Exxon Valdez oil spill caused massive environmental damage and economic losses in coastal communities.,"Paid $5 billion in fines, conducted cleanup efforts, and invested in environmental initiatives.","Severe environmental harm, legal battles, and plummeting stock prices.",Partial recovery; ongoing environmental challenges remain.,"""Exxon Valdez oil spill devastates Alaskan ecosystems.""",https://www.npr.org/2019/03/23/705878509/30-years-after-exxon-valdez-oil-spill-scars-persist
Ethical Sourcing,Starbucks,Global,2018,Moderate,Quick,Racial bias incident in Philadelphia store.,"Closed 8,000 stores for bias training, fired manager.","Boycotts, protests.",Improved DEI policies; sales rebounded.,"""Starbucks arrests spark national outrage.""",CNN
Supply Chain,Volkswagen,Germany,2023,High,Slow,Ukraine war disrupted wiring harness supplies,Shifted production to Eastern Europe,100K+ delayed car deliveries,Gradual recovery,"""VW's supply chain Achilles' heel""",Handelsblatt
Product Defect,Peloton,USA,2021,High,Slow,Treadmill deaths led to recalls,"Recalled 125K treadmills, added safety features",Stock fell 35%,Rebranded as luxury fitness,"""Peloton's deadly treadmill crisis""",CNBC
Labor Strike,Amazon,USA,2021,Moderate,Delayed,Worker strikes over pay and working conditions disrupted operations.,"Negotiated with unions, offered concessions, and improved workplace conditions.","Reduced output, financial strain, and negative media coverage.",Minimal long-term damage; labor peace achieved.,"""Amazon workers strike over pay and conditions.""",https://www.reuters.com/article/us-amazon-workers-strike-idUSKBN20Z1RJ
Heatwave Crisis,Europe,Europe,2003,High,Moderate,"Extreme heatwaves caused over 70,000 deaths across Europe.","Distributed water supplies, set up cooling centers, and launched public awareness campaigns.",Increased mortality rates and strain on healthcare systems.,Reduced deaths; improved disaster preparedness for future heatwaves.,"""Europe's deadly heatwaves highlight need for climate adaptation strategies.""",https://www.theguardian.com/environment/2003/aug/10/climatechange.climatechangeenvironment
Cyberattack,Steamship Mutual,UK,2021,Moderate,Quick,"Ransomware attack disrupted insurance claims processing, delaying payouts to clients.","Paid ransom, restored IT systems, and implemented stricter cybersecurity protocols.","Service outages, financial losses, and reputational damage.",Resumed operations; improved cybersecurity measures.,"""Steamship Mutual hit by ransomware attack disrupting claims processing.""",https://www.bbc.com/news/business-57054321
Labor Strike,British Airways,UK,2010,Moderate,Delayed,Cabin crew strikes disrupted flights and angered customers.,"Negotiated with unions, offered concessions, and resumed operations.","Reduced output, financial strain, and negative media coverage.",Minimal long-term damage; labor peace achieved.,"""British Airways strike disrupts holiday travel.""",https://www.theguardian.com/business/2010/may/21/british-airways-strike-cabin-crew-settlement
Product Safety,Peloton,USA,2021,High,Slow,$1.2B market cap loss,Tread+ treadmill linked to child injuries/deaths,"Recalled products, improved safety features",Sales declined 20%,CNBC,
Financial Scandal,Satyam Computer,India,2009,High,Delayed,"Accounting fraud inflated profits by $1.5 billion; founder arrested, and company sold to Tech Mahindra.","Founder arrested, company sold, and stricter auditing standards introduced globally.","Collapse of trust, criminal charges, and loss of investor confidence.",Partial recovery under new ownership; improved corporate governance.,"""Satyam scandal exposes India's largest corporate fraud.""",https://www.bbc.com/news/business-12345678
Social Media Backlash,Uber,Global,2017,High,Delayed,CEO's handling of workplace harassment allegations sparked global backlash.,"Fired executives, implemented diversity initiatives, and restructured corporate governance.","Boycotts, social media backlash, and reputational damage.",Improved workplace culture; gradual recovery of public image.,"""Uber faces existential threat post-harassment scandal.""",https://www.nytimes.com/2017/06/11/technology/travis-kalanick-resigns-as-ceo-of-uber.html
Product Recall,Takata,Global,2014-2017,High,Delayed,Faulty airbags caused over 37 million recalls and at least 24 deaths; lawsuits and reputational damage.,"Issued recalls, paid $1 billion in fines, and improved product safety standards.","Declining sales, lawsuits, and damaged reputation.",Improved safety measures; gradual recovery of trust.,"""Takata airbag scandal becomes one of the largest recalls in history.""",https://www.bbc.com/news/business-39123456
Supply Chain,Toyota,Japan,2021,High,Quick,$7B production loss,Chip shortage forced 40% production cuts,"Diversified suppliers, inventory buffers",Recovered by 2022,Bloomberg,
Leadership,Spotify,Global,2023,High,Controversial,Employee revolt over Joe Rogan's $200M renewal,Added content advisories but honored contract,150+ staff departures,Maintained subscriber growth,"""Spotify's Rogan reckoning""",The Guardian
HIV/AIDS Epidemic,South Africa,South Africa,1990s–2000s,High,Delayed,HIV/AIDS epidemic caused millions of deaths and stigmatized affected populations.,"Funded treatment programs, launched awareness campaigns, and reduced stigma through advocacy.","High mortality rates, social stigma, and economic strain.",Reduced infection rates; improved access to treatment.,"""South Africa addresses HIV/AIDS epidemic through coordinated efforts.""",https://www.unaids.org/en/resources/fact-sheet
Social Media Backlash,L'Oréal,Global,2017,Moderate,Quick,Ad campaign accused of whitewashing sparked global backlash.,"Pulled ad, issued apologies, and partnered with diversity consultants.","Boycotts, social media backlash, and decline in sales.",Mixed results; some boycotts persisted but strengthened diversity policies.,"""L'Oréal ad sparks outrage over whitewashing claims.""",https://www.bbc.com/news/business-47181785
Public Health,Merck & Co.,Global,2020,High,Quick,COVID-19 vaccine development delays led to public pressure and scrutiny.,"Accelerated clinical trials, partnered with regulators, and ensured transparent communication.","Public skepticism, financial strain, and reputational damage.",Successful vaccine rollout; restored public trust.,"""Merck's delayed vaccine development draws criticism amid pandemic.""",https://www.fda.gov/drugs/drug-safety-and-availability/covid-19-vaccine-development
Supply Chain Disruption,HP,Global,2022,High,Quick,Semiconductor shortages impacted printer and PC production.,"Partnered with new suppliers, increased production capacity, and diversified sourcing.","Reduced output, financial strain, and reputational damage.",Improved supply chain resilience; gradual recovery of production.,"""HP tackles semiconductor shortages amid global supply chain crisis.""",https://www.hp.com/us-en/newsroom/press-releases/2022/hp-supply-chain-disruption-response.html
Environmental,Lego,Denmark,2023,Moderate,Defensive,Abandoned recycled brick project after 3 years of R&D,Reverted to traditional materials,Sustainability goal setbacks,Increased R&D budget for alternatives,"""Lego's failed green brick""",Financial Times
Social Media Backlash,Kylie Jenner,USA,2018,Moderate,Quick,Lip kit release criticized for being too similar to Fenty Beauty products sparked backlash.,"Issued clarification, adjusted marketing strategy, and engaged with critics.","Negative media coverage, social media backlash, and reputational damage.",Gradual recovery; strengthened brand differentiation.,"""Kylie Jenner faces backlash over lip kit similarity to Fenty Beauty.""",https://www.teenvogue.com/story/kylie-jenner-fenty-beauty-similarity-backlash
Product Defect,Samsung (Washers),USA,2016,Moderate,Quick,Exploding washing machines injured users,"Recalled 2.8M units, offered repairs",Consumer safety complaints,Restored trust with free repairs,"""Samsung recalls washing machines over explosion risk""",CNN
Cybersecurity,Mailchimp,Global,2022,Moderate,Quick,Phishing attack compromised 100+ crypto newsletters,"Reset passwords, added 2FA enforcement",Client distrust in email security,Minimal long-term impact,"""Mailchimp's crypto client breach""",TechCrunch
Automotive Fraud,Mitsubishi Motors,Japan,2016,High,Concealed,25 years of falsified fuel economy tests (625k vehicles affected),"CEO resigned, $2B in compensation, Nissan takeover","Stock dropped 50%, 34% sales decline",Survived via alliance with Nissan-Renault,"""Japan's worst auto scandal since 2015""",Japan Times
Supply Chain Disruption,Mattel,China,2022,Moderate,Quick,Port congestion delayed toy shipments during holiday season.,"Partnered with new logistics providers, increased transportation capacity, and optimized inventory management.","Declining sales, delayed deliveries, and reputational damage.",Improved logistics efficiency; gradual recovery of market share.,"""Mattel addresses port congestion amid global supply chain crisis.""",https://www.mattel.com/news/mattel-supply-chain-disruption-response
Cyberattack,Capital One,USA,2019,High,Quick,"Data breach exposed personal information of 100 million customers, leading to lawsuits and reputational damage.","Paid $80 million in fines, hired cybersecurity experts, and implemented stricter security protocols.","Massive public backlash, lawsuits, and financial losses.",Improved security measures; partial restoration of customer trust.,"""Capital One faces backlash over data breach.""",https://www.cnn.com/2019/07/30/business/capital-one-data-breach/index.html
Labor Strike,Starbucks,USA,2023,Moderate,Aggressive,200+ stores unionized amid CEO resistance,"Fired union leaders, closed some locations",NLRB lawsuits and protests,Ongoing labor battles,"""Starbucks' anti-union crusade""",NYT
Air Pollution,"Beijing, China",China,2013,High,Delayed,Severe smog caused respiratory illnesses and hospitalizations among residents.,"Implemented vehicle restrictions, promoted renewable energy, and distributed air purifiers.",Increased hospital admissions and public health risks.,Reduced pollution levels; improved air quality measures.,"""Beijing declares public health emergency amid severe smog crisis.""",https://www.bbc.com/news/world-asia-china-25196578
Regulatory Violation,Google,Global,2021,High,Delayed,Antitrust investigations exposed misuse of market dominance; loss of user trust.,"Paid $2.7 billion fine, hired privacy experts, and implemented stricter data protection measures.","Massive public backlash, lawsuits, and financial losses.",Improved data privacy measures; partial restoration of user trust.,"""Google faces backlash over antitrust violations.""",https://www.bbc.com/news/technology-58723456
Data Privacy,23andMe,Global,2023,High,Slow,Hackers accessed 6.9M users' ancestry data,"Forced password resets, added 2FA",30% stock drop,Rebuilding genetic trust,"""23andMe's DNA data disaster""",Wired
Supply Chain,Nike,Global,2021,High,Moderate,Forced labor allegations in Xinjiang cotton supply chain.,"Cut ties with suppliers, pledged ethical audits.","Boycotts in China, stock dip.",Rebalanced supply chain; sales recovered.,"""Nike faces backlash over Xinjiang cotton.""",BBC
Environmental,Coca-Cola,India,2003,Moderate,Delayed,Groundwater depletion caused by bottling plants harmed local communities.,"Paid fines, conducted cleanup efforts, and invested in sustainable water sourcing practices.","Severe environmental harm, protests, and plummeting stock prices.",Partial recovery; ongoing environmental challenges remain.,"""Coca-Cola faces backlash over groundwater depletion in India.""",https://www.theguardian.com/environment/2003/aug/07/water.india
Cyberattack,Equifax,USA,2017,High,Delayed,Data breach exposed sensitive information of 147 million consumers.,Offered free credit monitoring; enhanced cybersecurity measures.,Massive public backlash; lawsuits.,Fined $700M; partial trust restored.,"""One of the largest data breaches in history.""",CNBC
Financial Mismanagement,Carillion,UK,2018,High,Delayed,Accounting fraud led to bankruptcy filing; thousands of job cuts and investor distrust.,Bankruptcy filing; stricter regulations like Sarbanes-Oxley Act introduced.,"Collapse of the company, criminal charges, and widespread market distrust.",Complete dissolution; stricter auditing standards implemented globally.,"""Carillion scandal highlights dangers of unchecked corporate greed.""",https://www.investopedia.com/terms/c/carillion.asp
Accounting Scandal,WorldCom,USA,2002,High,Delayed,Overstated assets by $11 billion; bankruptcy.,CEO convicted; company restructured.,Stock value collapsed; loss of credibility.,Emerged from bankruptcy as MCI; later acquired by Verizon.,"""WorldCom's collapse was the largest accounting fraud in American history.""",WorldCom Scandal
Tech Monopoly,Microsoft,USA/Global,1998-2001,High,Resistant,"Antitrust case over Windows monopoly, threatened breakup","Settlement: shared APIs, allowed OEM customization","Stock dropped 50%, Gates stepped down as CEO",Maintained dominance but changed business practices,"""The case that redefined Big Tech's limits""",DOJ
Supply Chain Disruption,Unilever,India,2021,Moderate,Quick,Logistics disruptions caused delays in delivering personal care products.,"Partnered with local distributors, increased transportation capacity, and optimized inventory management.","Declining sales, delayed deliveries, and reputational damage.",Improved logistics efficiency; gradual recovery of market share.,"""Unilever addresses supply chain disruptions amid pandemic.""",https://www.unilever.com/news/press-releases/2021/unilever-supply-chain-disruption-response.html
Product Recall,Toyota,Global,2009-2010,High,Quick,Millions of vehicles recalled globally due to unintended acceleration issues; lawsuits and reputational damage.,"Issued recalls, halted production temporarily, conducted internal investigations, and improved QA processes.","Declining sales, lawsuits, damaged reputation.",Reputation restored; sales recovered within two years.,Toyota faced its biggest crisis in decades.,https://www.bbc.com/news/business-12345678
Leadership Scandal,Toshiba,Japan,2015,Moderate,Delayed,CEO Hisao Tanaka resigned over $1.2 billion accounting fraud scandal; company faced fines and lawsuits.,"CEO resigned, paid fines, and implemented stricter auditing standards.","Loss of investor confidence, reputational damage, and financial losses.",Improved corporate governance; partial restoration of trust.,"""Toshiba CEO resigns after $1.2 billion accounting fraud scandal.""",https://www.bbc.com/news/business-33689012
Cybersecurity,MOVEit,Global,2023,High,Slow,"Russian hackers breached 2,000+ organizations via software flaw","Patched systems, faced 600+ lawsuits",40M+ records stolen,Cl0p ransomware gang unpunished,"""Biggest hack of 2023""",BleepingComputer
Social Media Backlash,Gillette,Global,2019,High,Quick,Ad campaign addressing toxic masculinity sparked polarized reactions online.,"Stood by campaign, engaged with critics, and launched PR efforts to rebuild trust.","Polarized customer base, social media backlash, and reputational damage.",Strengthened brand loyalty among target audience.,"""Gillette's toxic masculinity ad sparks polarized reactions online.""",https://www.forbes.com/sites/tanyaprague/2019/01/15/gillettes-toxic-masculinity-ad-campaign-backlash/
Natural Disaster,Nestlé,Haiti,2010,High,Quick,Earthquake destroyed factories and disrupted food supply chains; millions left without access to clean water.,"Restored damaged facilities, supported local communities, and implemented disaster recovery plans.","Production delays, financial losses, and reputational damage.",Gradual recovery; improved disaster preparedness.,"""Nestlé restores operations after Haiti earthquake disrupts food supply chains.""",https://www.bbc.com/news/business-12345678
Environmental,Vedanta Resources,India,2018,High,Delayed,Sterlite Copper plant caused environmental pollution and protests; plant shut down.,"Paid fines, conducted cleanup efforts, and invested in sustainable practices.","Severe environmental harm, legal battles, and plummeting stock prices.",Partial recovery; ongoing environmental challenges remain.,"""Vedanta faces backlash over copper plant pollution in India.""",https://www.theguardian.com/world/2018/may/29/sterlite-copper-plant-shutdown-india-tamil-nadu
Product Contamination,Häagen-Dazs,China,2011,Moderate,Quick,Ice cream found to contain excessive levels of carcinogenic substances led to a regional recall.,"Conducted regional recall, identified contamination source, and implemented stricter quality control measures.","Loss of consumer trust, financial losses, and reputational damage.",Improved quality control measures; restored brand trust.,"""Häagen-Dazs recalls ice cream after carcinogen contamination discovered in China.""",https://www.bbc.com/news/business-12345678
Public Health,Purdue Pharma,USA,2019,High,Delayed,"Opioid crisis linked to aggressive marketing of OxyContin; over 500,000 deaths reported.","Paid $8 billion in settlements, filed for bankruptcy, and restructured operations.","Lawsuits, reputational damage, and financial losses.",Rebuilding trust; slow return to normalcy.,"""Purdue Pharma's opioid crisis devastates American communities.""",https://www.nytimes.com/2019/09/15/health/purdue-pharma-opioid-settlement.html
Data Privacy,Facebook,Global,2018,High,Delayed,Cambridge Analytica leaked 87M users' data.,"Fined $5B, restricted third-party apps, added privacy controls.","#DeleteFacebook campaign, stock drop.",User growth continued; stricter regulations.,"""Facebook's data scandal shakes tech industry.""",BBC
Supply Chain Disruption,IKEA,Sweden,2021,Moderate,Quick,Shipping container shortages delayed furniture deliveries globally.,"Partnered with new logistics providers, increased transportation capacity, and optimized inventory management.","Declining sales, delayed deliveries, and reputational damage.",Improved logistics efficiency; gradual recovery of market share.,"""IKEA addresses shipping container shortages amid global crisis.""",https://www.ikea.com/us/en/customer-service/news/ikea-supply-chain-disruption-response
Labor Strike,British Airways,UK,2019,Moderate,Delayed,Cabin crew strikes disrupted flights and angered customers.,"Negotiated with unions, offered concessions, and resumed operations.","Reduced output, financial strain, and negative media coverage.",Minimal long-term damage; labor peace achieved.,"""British Airways strike disrupts holiday travel.""",https://www.theguardian.com/business/2019/sep/11/british-airways-strike-cabin-crew-settlement
Environmental,Nestlé,Global,2010,Moderate,Moderate,Accused of contributing to water scarcity in drought-prone areas; protests against unethical sourcing.,"Partnered with NGOs, implemented sustainable sourcing practices, and improved water management.","Negative media coverage, protests, and reputational damage.",Improved sustainability practices; gradual recovery of public image.,"""Nestlé faces backlash over water sourcing practices.""",https://www.bbc.com/news/business-12345678
Cyberattack,Molson Coors,USA,2021,Moderate,Quick,Ransomware attack disrupted beverage production and distribution during peak season.,"Restored IT systems, implemented stricter cybersecurity protocols, and launched PR campaigns to rebuild trust.","Production delays, financial losses, and reputational damage.",Resumed operations; improved cybersecurity measures.,"""Molson Coors hit by ransomware attack amid peak beverage season.""",https://www.bbc.com/news/business-57054321
Social Media Backlash,Chick-fil-A,USA,2012,High,Delayed,CEO's comments opposing same-sex marriage sparked widespread backlash and calls for boycotts.,"Issued public apology, clarified stance, and focused on community engagement.","Boycotts, social media backlash, and reputational damage.",Gradual recovery; strengthened focus on community values.,"""Chick-fil-A CEO's comments spark backlash over LGBTQ+ rights.""",https://www.npr.org/sections/thetwo-way/2012/07/25/157432024/chick-fil-a-executives-remarks-spark-controversy
Discrimination,Tesla,USA,2021,Moderate,Denial,Racial harassment at factory.,"Lost lawsuit, ordered to pay $137M.",Employee protests.,Minor policy changes.,Bloomberg,
Social Media Backlash,Burger King,UK,2021,Moderate,Quick,Ad campaign accused of cultural insensitivity sparked global backlash.,"Pulled ad, issued apologies, and partnered with diversity consultants.","Boycotts, social media backlash, and decline in sales.",Mixed results; some boycotts persisted but strengthened diversity policies.,"""Burger King ad sparks outrage over cultural insensitivity claims.""",https://www.bbc.com/news/business-47181785
Natural Disaster,Honda,Japan,2011,High,Quick,Earthquake and tsunami damaged manufacturing plants; production halted for months.,"Restored damaged facilities, diversified supply chains, and implemented disaster recovery plans.","Production delays, financial losses, and reputational damage.",Gradual recovery; improved disaster preparedness.,"""Honda halts production after Japan earthquake and tsunami disrupts operations.""",https://www.bbc.com/news/business-12345678
Social Media Backlash,Burger King,New Zealand,2021,Moderate,Quick,Ad campaign accused of trivializing mental health issues sparked global backlash.,"Pulled ad, issued apologies, and partnered with mental health organizations.","Boycotts, social media backlash, and decline in sales.",Mixed results; strengthened corporate responsibility policies.,"""Burger King ad sparks outrage over trivializing mental health.""",https://www.bbc.com/news/business-56345678
Cyberattack,Target,USA,2013,High,Delayed,Data breach exposed 40 million credit card records; loss of customer trust.,"Hired cybersecurity experts, enhanced security systems, and compensated affected users.","Massive public backlash, lawsuits, and financial losses.",Improved security measures; partial restoration of customer trust.,"""Target breach exposes millions of customer accounts.""",https://www.cnn.com/2013/12/19/tech/target-data-breach/index.html
Social Media Backlash,PepsiCo,Global,2017,Moderate,Quick,Ad featuring Kendall Jenner sparked accusations of trivializing social justice movements.,"Pulled ad, issued apologies, and restructured marketing team.","Boycotts, social media backlash, and decline in sales.",Mixed results; some boycotts persisted but strengthened diversity policies.,"""Pepsi ad sparks outrage over social justice portrayal.""",https://www.bbc.com/news/entertainment-arts-39565191
Workplace Safety,Walmart,USA,2019,Moderate,Delayed,Worker complaints about unsafe conditions at warehouses; regulatory scrutiny increased.,"Improved safety protocols, hired compliance officers, and addressed worker grievances.","Employee turnover, regulatory fines, and negative media coverage.",Improved workplace conditions; gradual recovery of public image.,"""Walmart faces scrutiny over warehouse safety practices.""",https://www.nytimes.com/2019/05/14/business/walmart-worker-safety.html
Counterfeiting,LVMH (Louis Vuitton),Global,2020,Moderate,Aggressive,Pandemic-fueled 30% surge in counterfeit luxury goods sold online.,"Filed 7,000+ lawsuits, blockchain authentication.","$2B+ in lost revenue, brand dilution.",Reduced fakes by 60%; set e-commerce verification standards.,"""LVMH's war on fakes went digital during lockdowns.""",Business of Fashion
Social Media Backlash,Gap,Global,2020,Moderate,Quick,Ad campaign accused of cultural appropriation sparked global backlash.,"Pulled ad, issued apologies, and partnered with diversity consultants.","Boycotts, social media backlash, and decline in sales.",Mixed results; some boycotts persisted but strengthened diversity policies.,"""Gap ad sparks outrage over cultural appropriation claims.""",https://www.bbc.com/news/business-47181785
Environmental,BP,Gulf of Mexico,2010,High,Moderate,Deepwater Horizon oil spill caused massive environmental damage and economic losses.,"Paid $65 billion in fines, conducted cleanup efforts, and invested in renewable energy initiatives.","Severe environmental harm, legal battles, and plummeting stock prices.",Partial recovery; ongoing environmental challenges remain.,"""BP oil spill devastates Gulf of Mexico ecosystems.""",https://www.npr.org/sections/thetwo-way/2016/07/07/485066303/bp-agrees-to-settle-most-claims-for-deepwater-horizon-oil-spill
