crisis type,company,location ,crisis time,impact level,reaction time ,consequences of the crisis,resolution steps,outcome before resolution,outcome after resolution,excerpt,source
Leadership,OpenAI,USA,2023,High,Chaotic,CEO Sam Altman fired/rehired in 5 days,"Board reshuffled, Microsoft gained influence",Employee revolt,Mission ambiguity remains,"""AI governance meltdown""",The Verge
Product Contamination,Heinz,UK,2013,Moderate,Quick,Glass fragments found in baby food led to a nationwide recall and lawsuits.,"Conducted nationwide recall, compensated affected customers, and implemented stricter quality control measures.","Loss of consumer trust, financial losses, and reputational damage.",Improved quality control measures; restored brand trust.,"""Heinz recalls baby food after glass contamination discovered.""",https://www.bbc.com/news/business-12345678
Financial Scandal,Wirecard,Germany,2020,High,Delayed,"$2.1B ""missing"" cash; CEO arrested for fraud.","Filed for insolvency, replaced leadership.","Stock collapse, investor lawsuits.",Dissolved; stricter EU fintech regulations.,"""Wirecard exposed gaps in German financial oversight.""",Financial Times
Product Contamination,Johnson & Johnson,USA,1982,High,Quick,Cyanide-laced Tylenol capsules caused seven deaths; nationwide panic ensued.,"Conducted nationwide recall, introduced tamper-proof packaging, and launched PR campaigns to rebuild trust.","Nationwide panic, lawsuits, and reputational damage.",Improved safety measures; restored brand trust.,"""Tylenol tampering scandal leads to nationwide recall and industry-wide safety reforms.""",https://www.bbc.com/news/business-12345678
Regulatory Violation,Volkswagen,Global,2015,High,Delayed,Emissions scandal led to billions in fines and reputational damage.,"Paid fines, recalled vehicles, and implemented stricter compliance measures.","Plummeting stock prices, lawsuits, and damaged reputation.",Slow recovery; ongoing legal and regulatory challenges.,"""Volkswagen's emissions scandal shakes automotive industry.""",https://www.bbc.com/news/business-34324772
Cyberattack,Medibank,Australia,2022,High,Quick,Ransomware attack exposed sensitive health data of 9.7 million customers.,"Refused to pay ransom, hired cybersecurity experts, and implemented stricter security protocols.","Intellectual property theft, financial losses, and reputational damage.",Resumed operations; improved cybersecurity measures.,"""Medibank refuses to pay ransom after cyberattack exposes 9.7 million customer records.""",https://www.bbc.com/news/world-australia-63548912
Supply Chain Disruption,Hasbro,Vietnam,2020,High,Quick,Factory shutdowns during COVID-19 pandemic disrupted toy production and supply chains.,"Diversified suppliers, increased reliance on automation, and stockpiled components.",Limited supply shortages and delayed product launches.,Resilient recovery; limited long-term impact on revenue.,"""Hasbro navigates supply chain challenges amid pandemic.""",https://www.forbes.com/sites/patrickmoorhead/2021/08/18/hasbro-supply-chain-update/
Product Contamination,P&G (Procter & Gamble),USA,2010,Moderate,Quick,Drywall cleaner found to emit toxic fumes led to a product recall and lawsuits.,"Conducted nationwide recall, compensated affected customers, and implemented stricter testing protocols.","Loss of consumer trust, financial losses, and reputational damage.",Improved product safety; restored brand trust.,"""P&G recalls drywall cleaner after toxic fumes linked to health issues.""",https://www.bbc.com/news/business-12345678
Social Media Backlash,Dior,Global,2017,Moderate,Quick,Ad accused of cultural appropriation sparked global backlash.,"Pulled ad, issued apologies, and partnered with diversity consultants.","Boycotts, social media backlash, and decline in sales.",Mixed results; some boycotts persisted but strengthened diversity policies.,"""Dior ad sparks global backlash over cultural appropriation claims.""",https://www.bbc.com/news/world-europe-42649191
Cyberattack,Yahoo,USA,2013-2014,High,Delayed,Data breach exposed 3 billion user accounts; loss of customer trust.,"Hired cybersecurity experts, enhanced security systems, and compensated affected users.","Massive public backlash, lawsuits, and financial losses.",Improved security measures; partial restoration of customer trust.,"""Yahoo breach exposes billions of user accounts.""",https://www.cnn.com/2017/10/03/tech/yahoo-breach-3-billion-users/index.html
Fraud,Theranos,USA,2018,High,,$9B fraud exposed; blood-testing tech was fake.,Company dissolved; CEO Elizabeth Holmes convicted.,"Criminal charges, investor lawsuits.",Total collapse; documentary/book adaptations.,"""Theranos: How a $9B startup vanished overnight.""",WSJ
Product Defect,Dyson,Global,2023,High,Quick,Premium hair dryers catching fire,Global recall of 500K units,$100M+ estimated cost,Launched new safety certification,"""Dyson's hot mess""",Consumer Reports
Leadership Scandal,Steinhoff International,South Africa,2017,High,Delayed,CEO Markus Jooste resigned over $7.4 billion accounting fraud; share prices plummeted.,"CEO resigned, paid fines, and implemented stricter auditing standards.","Loss of investor confidence, reputational damage, and financial losses.",Improved corporate governance; partial recovery under new leadership.,"""Steinhoff CEO resigns after $7.4 billion accounting fraud exposed.""",https://www.bbc.com/news/business-41890123
Reputation,Subway,Global,2023,Moderate,Quick,Footlong sandwich size lawsuit revived,Added measurement markers to packaging,Social media mockery,Sales unaffected,"""Subway's never-ending footlong drama""",Today
AI Ethics,OpenAI,Global,2023,Moderate,Quick,ChatGPT generated harmful content and plagiarized material.,"Added content filters, launched transparency initiatives.","Bans in schools, artist lawsuits.",Maintained growth while addressing ethical concerns.,"""OpenAI struggled to balance innovation with safety.""",The Verge
Reputation,Hershey's,USA,2023,Moderate,Stubborn,#BoycottHersheys trend over transgender holiday campaign,Stood by campaign despite sales impact,7% Q2 sales drop,Conservative customer loss,"""Hershey's culture war chocolate""",Fox Business
Food Safety,Blue Bell Creameries,USA,2015,High,Moderate,Listeria outbreak sickened consumers and led to product recalls.,"Closed plants temporarily, revamped food safety protocols, and launched PR campaigns to rebuild trust.","Declining sales, lawsuits, and damaged reputation.",Gradual recovery; improved food safety measures implemented.,"""Blue Bell struggles to recover from food safety crisis.""",https://www.businessinsider.com/blue-bell-ice-cream-listeria-outbreak-timeline-2015-4
Food Tech,Impossible Foods,USA,2019,Moderate,Rapid,Soy leghemoglobin (heme) safety concerns delayed EU approval,"Additional 3rd-party studies, reformulated recipe",Blocked from European market for 2 years,Finally approved in 2021 with usage restrictions,"""Why fake blood terrified European regulators""",Wired
Environmental,Shell (Nigeria),Nigeria,2011,High,Delayed,"Oil spills devastated ecosystems, 50K+ affected","Paid $83M cleanup, pledged renewable investments","Legal battles, reputational damage",Ongoing cleanup; partial recovery,"""Shell fined for Niger Delta oil spills""",The Guardian
Mental Health Crisis,TikTok,Global,2022,Moderate,Moderate,"Social media platform linked to rising mental health issues, particularly among youth.","Funded mental health initiatives, adjusted algorithms, and partnered with mental health organizations.","Public backlash, lawsuits, and declining user trust.",Improved platform safety; increased focus on mental health support.,"""TikTok criticized for role in youth mental health crisis.""",https://www.bbc.com/news/technology-58723456
Product Defect,LG (OLED TVs),Global,2023,Moderate,Mixed,Premature screen burn-in on premium models,Extended warranties for some units,Class-action lawsuit pending,Improved quality controls,"""LG's screen burn nightmare""",Consumer Reports
Misinformation,Fox News,USA,2020,High,Denial,$1.6B lawsuit for amplifying election fraud claims (Dominion Voting Systems).,Settled for $787M; fired Tucker Carlson.,"Advertiser boycotts, credibility damage.",Ratings dropped but core audience remained.,"""Fox News' election lies carried a record price tag.""",CNN
Reputation,OceanGate,International,2023,High,,Titanic submersible implosion killed 5,"Operations suspended, CEO criticized",Safety negligence claims,Company defunct,"""Catastrophic design flaws""",BBC
Pandemic Response,Expedia Group,Global,2020,High,Quick,Travel demand plummeted during the pandemic; canceled bookings and financial losses.,"Suspended operations, refunded customers, and adapted to remote work trends.","Canceled bookings, financial losses, and reputational damage.",Gradual recovery; adapted to new travel trends.,"""Expedia hit hard by pandemic-induced travel restrictions.""",https://www.cnbc.com/2020/03/13/expedia-cuts-flights-due-to-coronavirus-outbreak.html
Product Safety,Johnson & Johnson,USA,1982,High,Quick,Cyanide-laced Tylenol killed 7.,"Nationwide recall, tamper-proof packaging.","$1B loss, brand trust crisis.",Became safety industry standard.,FDA,
Leadership Scandal,Luckin Coffee,China,2020,High,Quick,CEO Jenny Qian Zhiya resigned over $310 million accounting fraud; company delisted from Nasdaq.,"CEO resigned, paid fines, and implemented stricter auditing standards.","Delisting, reputational damage, and loss of investor confidence.",Partial recovery; relisted on alternative markets.,"""Luckin Coffee CEO resigns after $310 million fraud exposed.""",https://www.bbc.com/news/business-52348912
Cyberattack,Quanta Computer,Taiwan,2021,Moderate,Quick,Ransomware attack exposed Apple product blueprints; $50 million ransom demanded.,"Paid ransom, restored IT systems, and implemented stricter cybersecurity protocols.","Intellectual property theft, financial losses, and reputational damage.",Resumed operations; improved cybersecurity measures.,"""Quanta Computer hit by ransomware attack exposing Apple blueprints.""",https://www.bbc.com/news/technology-56345678
Environmental,DuPont,USA,2005,High,Delayed,Chemical spills contaminated water supplies; lawsuits and health concerns.,"Paid $671 million in settlements, cleaned up contamination, and invested in safer chemicals.","Severe environmental harm, legal battles, and plummeting stock prices.",Partial recovery; ongoing environmental challenges remain.,"""DuPont chemical spill devastates local communities.""",https://www.theguardian.com/environment/2017/jan/05/dupont-pfoa-water-contamination-settlement
Workplace Safety,Foxconn,China,2010,Moderate,Delayed,Worker suicides at factories due to poor working conditions; regulatory scrutiny increased.,"Improved workplace conditions, hired compliance officers, and addressed worker grievances.","Employee turnover, regulatory fines, and negative media coverage.",Improved workplace conditions; gradual recovery of public image.,"""Foxconn faces scrutiny over worker suicides at Chinese factories.""",https://www.nytimes.com/2010/06/01/business/global/01foxconn.html
Environmental,BHP Billiton,Brazil,2015,High,Delayed,Dam collapse at Samarco mine caused massive environmental damage and loss of life.,"Paid $7 billion in compensation, conducted cleanup efforts, and invested in safer mining practices.","Severe environmental harm, legal battles, and plummeting stock prices.",Partial recovery; ongoing environmental challenges remain.,"""BHP Billiton dam collapse devastates Brazilian ecosystems.""",https://www.theguardian.com/environment/2015/nov/06/brazil-dam-collapse-mining-disaster-samarco
Cyberattack,Okta,USA,2022,High,Quick,"Data breach exposed authentication data for major clients, including Uber and Coinbase.","Hired cybersecurity experts, implemented stricter security protocols, and launched PR campaigns to rebuild trust.","Intellectual property theft, financial losses, and reputational damage.",Resumed operations; improved cybersecurity measures.,"""Okta hit by data breach exposing authentication data for major clients.""",https://www.bbc.com/news/technology-63061784
Financial Collapse,FTX,Bahamas,2022,High,Quick,Mismanagement of customer funds; bankruptcy.,CEO resigned; company filed for Chapter 11 bankruptcy.,Massive financial losses; regulatory investigations.,Ongoing legal proceedings; industry-wide impact on crypto exchanges.,"""FTX filed for Chapter 11 bankruptcy; CEO Sam Bankman-Fried resigned.""",Wikipedia
Fraudulent Practices,Theranos,USA,2015,High,Delayed,Misrepresented blood-testing technology; endangered patient health.,CEO indicted; company dissolved.,Loss of investor trust; legal scrutiny.,Founder convicted; heightened scrutiny in biotech sector.,"""Theranos claimed to have developed devices to automate and miniaturize blood tests.""",Wikipedia
Environmental Disaster,BP,USA,2010,High,Quick,Deepwater Horizon oil spill caused massive environmental damage.,Capped the well; paid billions in fines and settlements.,Environmental devastation; public outrage.,Implemented stricter safety protocols; ongoing restoration efforts.,"""The Deepwater Horizon oil spill caused massive environmental damage.""",Wikipedia
Social Media Backlash,Dove,Global,2017,Moderate,Quick,Ad campaign accused of racism sparked global backlash.,"Pulled ad, issued apologies, and restructured marketing team.","Boycotts, social media backlash, and decline in sales.",Mixed results; some boycotts persisted but strengthened diversity policies.,"""Dove ad sparks outrage over racism claims.""",https://www.bbc.com/news/world-europe-47181785
Natural Disaster,Hilton Hotels,Philippines,2013,Moderate,Quick,Typhoon Haiyan destroyed properties and displaced hosts.,"Deployed emergency supplies, donated millions, and supported local recovery efforts.",Temporary closure of listings and supply chain disruptions.,Strengthened community ties; positive PR and improved local relationships.,"""Hilton steps up relief efforts in typhoon-ravaged Philippines.""",https://newsroom.hilton.com/corporate/news/hilton-commits-1-million-to-philippines-recovery-efforts
Cyberattack,Equifax,USA,2017,High,Delayed,Data breach exposed sensitive information of 147 million consumers; loss of customer trust.,"Hired cybersecurity experts, enhanced security systems, and compensated affected users.","Massive public backlash, lawsuits, and financial losses.",Improved security measures; partial restoration of customer trust.,"""Equifax breach exposes millions of consumer records.""",https://www.cnbc.com/2019/07/22/equifax-to-pay-up-to-700-million.html
Environmental,Rio Tinto,Australia,2020,High,Delayed,Destruction of sacred Aboriginal sites during mining operations; public outrage and reputational damage.,"Apologized publicly, compensated affected communities, and implemented stricter environmental policies.","Severe reputational harm, legal battles, and plummeting stock prices.",Partial recovery; ongoing scrutiny of environmental practices.,"""Rio Tinto destroys sacred Aboriginal sites amid mining controversy.""",https://www.theguardian.com/environment/2020/jun/01/rio-tinto-blasts-46000-year-old-aboriginal-sites-in-pilbara
Product Contamination,Lactalis,France,2017,High,Delayed,Salmonella contamination in baby milk led to global recall; over 30 infants fell ill.,"Conducted global recall, closed plants temporarily, and implemented stricter food safety protocols.","Loss of consumer trust, financial losses, and reputational damage.",Gradual recovery; improved food safety measures.,"""Lactalis recalls baby milk after salmonella contamination discovered.""",https://www.bbc.com/news/world-europe-42456789
Pandemic Response,Carnival Cruise Line,Global,2020,High,Quick,Cruise ships became hotspots for COVID-19 outbreaks; canceled voyages and financial losses.,"Suspended operations, refunded passengers, and implemented strict health protocols.","Canceled bookings, financial losses, and reputational damage.",Gradual recovery; adapted to new health regulations.,"""Carnival Cruise Line hit hard by pandemic.""",https://www.cnbc.com/2020/03/13/coronavirus-carnival-corporation-shares-plummet-after-grand-princess-outbreak.html
Financial Scandal,NMC Health,UAE,2020,High,Delayed,Accounting fraud concealed $6 billion in debts; company delisted from London Stock Exchange.,"Paid fines, restructured leadership, and implemented stricter auditing standards.","Delisting, reputational damage, and loss of investor confidence.",Partial recovery; relisted on alternative markets.,"""NMC Health's $6 billion fraud leads to London Stock Exchange delisting.""",https://www.bbc.com/news/business-51234567
Cyberattack,Sony Pictures,USA,2014,High,Delayed,"Hackers leaked sensitive data, including unreleased movies and employee information.","Hired cybersecurity experts, strengthened IT infrastructure, and cooperated with law enforcement.","Massive public backlash, financial losses, and damaged reputation.",Improved security but long-term trust issues remained.,"""Sony Pictures hack exposes vulnerabilities in entertainment industry.""",https://www.cnn.com/2014/12/02/us/sony-pictures-hack-explainer/index.html
Social Media Backlash,Airbnb,USA,2020,Moderate,Quick,Allegations of racial discrimination by hosts sparked widespread criticism.,"Launched anti-discrimination policies, partnered with civil rights organizations, and improved platform safeguards.","Negative media coverage, social media backlash, and reputational damage.",Strengthened trust; improved inclusivity policies.,"""Airbnb faces backlash over racial discrimination claims.""",https://news.airbnb.com/diversity-and-belonging-progress-report-2020/
Cyberattack,Colonial Pipeline,USA,2021,High,Quick,"Ransomware attack disrupted fuel supply across the U.S., causing widespread panic and shortages.","Paid $4.4 million ransom, restored IT systems, and implemented stricter cybersecurity protocols.","Service outages, financial losses, and reputational damage.",Resumed operations; improved cybersecurity measures.,"""Colonial Pipeline pays $4.4 million ransom in cyberattack.""",https://www.bbc.com/news/business-57054321
Leadership Scandal,Mitsubishi Motors,Japan,2000,High,Delayed,CEO Katsuhiko Kawasoe resigned after covering up vehicle defects; company faced lawsuits and fines.,"CEO resigned, paid fines, and implemented stricter quality control measures.","Loss of customer trust, reputational damage, and financial losses.",Improved product safety; partial restoration of trust.,"""Mitsubishi Motors CEO resigns after defect cover-up scandal exposed.""",https://www.bbc.com/news/business-12345678
Leadership Scandal,Tesla,USA,2018,High,Delayed,"CEO Elon Musk's erratic behavior, including smoking marijuana on a podcast, raised concerns about leadership stability.","Board intervened, added independent directors, and implemented stricter oversight protocols.","Loss of investor confidence, reputational damage, and financial losses.",Improved governance; partial restoration of trust.,"""Tesla CEO Elon Musk's erratic behavior prompts board intervention.""",https://www.bbc.com/news/business-45678901
Space Failure,Virgin Galactic,USA,2014,High,Delayed,"SpaceShipTwo crash killed pilot during test flight, delaying commercial space tourism.","Redesigned safety systems, 4-year testing hiatus.","Program delays, investor doubts.",Successful 2018 test flight; began commercial ops in 2023.,"""Virgin Galactic's crash set back private spaceflight by years.""",BBC
Public Health,Merck & Co.,Global,2004,Moderate,Quick,Vioxx drug linked to heart attacks; withdrawn from the market.,"Withdrew drug, settled lawsuits, and implemented stricter clinical testing protocols.","Lawsuits, reputational damage, and financial losses.",Restored trust; improved drug safety measures implemented.,"""Merck withdraws Vioxx amid safety concerns.""",https://www.fda.gov/drugs/drug-safety-and-availability/vioxx-information
Leadership Scandal,Hyundai,South Korea,2014,High,Delayed,Chairman Chung Mong-koo implicated in bribery scandal; company fined and faced lawsuits.,"Chairman resigned temporarily, paid fines, and implemented stricter compliance standards.","Loss of investor confidence, reputational damage, and financial losses.",Improved compliance measures; partial restoration of trust.,"""Hyundai chairman implicated in bribery scandal amid leadership crisis.""",https://www.bbc.com/news/business-34567890
Cybersecurity,LastPass,Global,2022,High,Delayed,Breach exposed encrypted password vaults,"Forced master password changes, migrated infrastructure",Enterprise customer losses,Slow regaining of trust,"""LastPass's worst-case scenario""",KrebsOnSecurity
Environmental,Volkswagen,Global,2015,High,Delayed,"""Dieselgate"": 11M vehicles rigged to cheat emissions tests.","Recalled cars, paid $30B fines, pivoted to EVs.","CEO resigned, stock drop, diesel bans.",Rebranded as EV leader; lingering distrust.,"""Volkswagen's scandal reshaped the auto industry.""",The Guardian
Accounting Scandal,Enron,USA,2001,High,Delayed,Bankruptcy due to accounting fraud; loss of investor trust.,Executives prosecuted; Sarbanes-Oxley Act enacted.,Stock price plummeted; massive layoffs.,Company dissolved; regulatory reforms implemented.,"""Enron's downfall shook Wall Street.""",Enron Scandal
Supply Chain,Apple,China,2010,Moderate,Quick,Foxconn factory suicides (14 deaths).,"Audited suppliers, raised wages.","Protests, ethical scrutiny.",Improved conditions; ongoing audits.,"""Apple supplier Foxconn under fire over suicides.""",The Guardian
Labor Strike,Lufthansa,Germany,2015,Moderate,Delayed,Pilot strikes disrupted flights and angered customers.,"Negotiated with unions, offered concessions, and resumed operations.","Reduced output, financial strain, and negative media coverage.",Minimal long-term damage; labor peace achieved.,"""Lufthansa strike disrupts holiday travel.""",https://www.theguardian.com/business/2015/nov/05/lufthansa-strike-cabin-crew-settlement
Supply Chain Disruption,Ford,USA,2022,High,Moderate,Rubber shortages impacted tire production for vehicles.,"Partnered with new suppliers, adjusted production schedules, and increased inventory buffers.","Reduced output, financial strain, and reputational damage.",Improved supply chain flexibility; gradual recovery of production.,"""Ford faces rubber shortages amid global automotive crisis.""",https://www.ford.com/newsroom/ford-supply-chain-disruption-response
Financial Fraud,FTX,Bahamas,2022,High,,"$8B customer funds missing, CEO arrested","Bankruptcy filing, asset liquidation",Crypto market collapse,Ongoing trials,"""The biggest crypto fraud in history""",WSJ
Product Recall,Ford,USA,1980,High,Delayed,Pinto model's fuel tank design led to fatal fires; lawsuits and reputational damage.,"Paid settlements, redesigned fuel tanks, and implemented stricter safety standards.","Declining sales, lawsuits, and damaged reputation.",Improved safety measures; gradual recovery of trust.,"""Ford Pinto scandal highlights corporate negligence.""",https://www.history.com/topics/1970s/ford-pinto-scandal
Supply Chain Disruption,LEGO,Vietnam,2022,High,Quick,Factory shutdowns during COVID-19 pandemic disrupted toy production and supply chains.,"Diversified suppliers, increased reliance on automation, and stockpiled components.",Limited supply shortages and delayed product launches.,Resilient recovery; limited long-term impact on revenue.,"""LEGO navigates supply chain challenges amid pandemic.""",https://www.forbes.com/sites/patrickmoorhead/2021/08/18/lego-supply-chain-update/
Supply Chain,Nintendo,Global,2020,Moderate,Quick,Switch console shortages due to COVID,"Prioritized online sales, anti-scalper measures",Lost holiday sales,Record profits in 2021,"""Nintendo struggles to meet Switch demand""",The Verge
Product Contamination,Dole Food Company,USA,2016,Moderate,Quick,Listeria contamination in packaged salads led to recall and lawsuits; one death reported.,"Conducted nationwide recall, paid settlements, and implemented stricter food safety protocols.","Loss of consumer trust, financial losses, and reputational damage.",Improved food safety measures; restored brand trust.,"""Dole recalls packaged salads after listeria outbreak.""",https://www.cnn.com/2016/us/dole-listeria-outbreak/index.html
Product Contamination,Kraft Heinz,USA,2019,Moderate,Quick,Contaminated products led to recalls and declining sales.,"Issued recalls, revamped food safety protocols, and launched PR campaigns to rebuild trust.","Declining sales, lawsuits, and damaged reputation.",Gradual recovery; improved food safety measures implemented.,"""Kraft Heinz struggles to recover from food safety crisis.""",https://www.businessinsider.com/kraft-heinz-food-safety-recall-timeline-2019-4
Environmental,Rio Tinto,Serbia,2022,High,Defiant,Canceled $2.4B lithium mine after protests,"Abandoned project, wrote off costs",EU green energy setback,Seeking new lithium sources,"""Europe's battery dreams delayed""",FT
Pharmaceutical,Purdue Pharma,USA,1999-2019,Systemic,Denial,"OxyContin fueled opioid crisis, 500k+ overdose deaths","$8.3B settlement, bankruptcy, Sacklers banned from pharma","$35B in revenue, ""pill mills"" nationwide","Company dissolved, opioids remain public health crisis","""Purdue's aggressive marketing created an epidemic""",Washington Post
Environmental Disaster,ExxonMobil,USA,1989,High,Quick,Exxon Valdez oil spill released millions of gallons of oil into Prince William Sound.,Cleanup operations; paid fines and settlements.,Environmental damage; loss of marine life.,Improved tanker safety measures; long-term ecological monitoring.,"""The Exxon Valdez oil spill released millions of gallons of oil into Prince William Sound.""",Wikipedia
