Product Contamination,Almarai Oman,Oman,2022,Moderate,Quick,Milk products found to contain harmful bacteria; regional recall issued.,"Conducted regional recall, compensated affected customers, and implemented stricter food safety protocols.","Loss of consumer trust, financial losses, and reputational damage.",Improved food safety measures; restored brand trust.,"""Almarai Oman recalls milk products after bacterial contamination discovered.""",https://www.bbc.com/news/business-56789012
Ethical Violations,Dana Gas,UAE,2021,Moderate,Quick,Executives accused of bribery in Kurdistan oil deals.,"Replaced leadership, cooperated with authorities, and revised ethics policies.","Shareholder lawsuits, stock volatility, and project delays.",Rebuilt governance framework; resumed operations.,"""Dana Gas embroiled in bribery scandal.""",https://www.ft.com/dana-gas-bribery-scandal
Cyberattack,Saudi Arabian Airlines,Saudi Arabia,2023,High,Quick,Ransomware attack disrupted flight operations; customer data exposed.,"Paid ransom, restored IT systems, and implemented stricter cybersecurity protocols.","Service outages, financial losses, and reputational damage.",Resumed operations; improved cybersecurity measures.,"""Saudi Arabian Airlines hit by ransomware attack disrupting flights.""",https://www.bbc.com/news/technology-62348912
Cyberattack,Saudi Electricity Company (SEC),Saudi Arabia,2023,High,Quick,Ransomware attack disrupted power grid operations; customer data exposed.,"Paid ransom, restored IT systems, and implemented stricter cybersecurity protocols.","Service outages, financial losses, and reputational damage.",Resumed operations; improved cybersecurity measures.,"""Saudi Electricity Company hit by ransomware attack disrupting power grid.""",https://www.bbc.com/news/technology-56789012
Financial Scandal,Banque Populaire,Morocco,2020,Moderate,Delayed,Mismanagement led to $400 million in losses; senior executives implicated.,"Executives resigned, paid fines, and implemented stricter auditing standards.","Loss of investor confidence, reputational damage, and financial losses.",Improved corporate governance; partial recovery under new leadership.,"""Banque Populaire loses $400 million due to mismanagement.""",https://www.bbc.com/news/business-46789012
Natural Disaster,Wadi Dayqah Dam Authority,Oman,2021,High,Quick,Earthquake damaged dam infrastructure; disrupted water supply nationwide.,"Restored damaged facilities, diversified supply chains, and implemented disaster recovery plans.","Production delays, financial losses, and reputational damage.",Gradual recovery; improved disaster preparedness.,"""Wadi Dayqah Dam Authority restores operations after earthquake damages facilities.""",https://www.bbc.com/news/world-africa-56789012
Financial Scandal,Oman Investment Authority,Oman,2019,Moderate,Delayed,Accounting fraud led to $150 million in overstated profits; CEO resignation and reputational damage.,"Paid fines, implemented stricter auditing, and restructured leadership.","Collapse of trust, criminal charges, and loss of investor confidence.",Rebuilt trust; introduced global compliance standards.,"""Oman Investment Authority scandal rocks Omani banking industry.""",https://www.bbc.com/news/business-46789012
Labor Exploitation,Qatar Airways Cargo,Qatar,2021,Moderate,Delayed,Migrant workers reported wage theft and poor conditions.,"Paid back wages, improved labor camps, and partnered with ILO.","Negative media coverage, boycotts, and contract losses.","Certified as ""ethical employer"" by labor watchdogs.","""Qatar Airways Cargo accused of labor abuses.""",https://www.aljazeera.com/qatar-airways-labor-2021
Leadership Scandal,Jordan Petroleum Refinery Company,Jordan,2020,Moderate,Quick,CEO accused of nepotism and mismanagement; faced internal dissent.,CEO retained but implemented stricter oversight protocols and launched investigations.,"Loss of employee trust, reputational damage, and financial losses.",Improved corporate governance; partial restoration of trust.,"""Jordan Petroleum Refinery CEO accused of nepotism amid internal dissent.""",https://www.bbc.com/news/business-56789012
E-Sports Match Fixing,YaLLa Esports,UAE,2022,Moderate,Quick,CS:GO team bribed to throw matches,"Lifetime bans, returned prizes",Tournament disqualification,New integrity monitoring,"""UAE esports org in match-fixing scheme""",https://www.esportsinsider.com/yalla-fixing-2022
Technology Failure,du Telecom,UAE,2023,High,Quick,Nationwide network outage disrupted services for 24 hours.,Invested in infrastructure upgrades and issued customer compensation.,"Regulatory fines, customer churn, and brand damage.",Restored services; enhanced network resilience.,"""du Telecom outage sparks customer outrage.""",https://www.khaleejtimes.com/du-outage-2023
Financial Scandal,Oman Dairy Company,Oman,2021,Moderate,Delayed,Mismanagement led to $50 million in losses; senior executives implicated.,"Executives resigned, paid fines, and implemented stricter auditing standards.","Loss of investor confidence, reputational damage, and financial losses.",Improved corporate governance; partial recovery under new leadership.,"""Oman Dairy Company loses $50 million due to mismanagement.""",https://www.bbc.com/news/business-46789012
Space Hotel Delay,Axiom Space Station,UAE,2025,High,Delayed,2-year postponement of modules,New contractors hired,Investor lawsuits,First module launched,"""UAE space hotel behind schedule""",https://www.spaceinsider.com/axiom-delay-2025
Clinical Trial Fraud,Julphar Pharmaceuticals,UAE,2022,High,Delayed,Faked diabetes drug trial data,"Retracted studies, reformed R&D",FDA blacklist,Reinstated after 2 years,"""Julphar faked drug trials""",https://www.bioworld.com/julphar-fraud-2022
Leadership Scandal,Yemen Airways,Yemen,2019,Moderate,Quick,CEO accused of nepotism and mismanagement; faced internal dissent.,CEO retained but implemented stricter oversight protocols and launched investigations.,"Loss of employee trust, reputational damage, and financial losses.",Improved corporate governance; partial restoration of trust.,"""Yemen Airways CEO accused of nepotism amid internal dissent.""",https://www.bbc.com/news/business-56789012
Cyberattack,Mobily,Saudi Arabia,2023,High,Quick,Ransomware attack disrupted telecommunications services; customer data exposed.,"Paid ransom, restored IT systems, and implemented stricter cybersecurity protocols.","Service outages, financial losses, and reputational damage.",Resumed operations; improved cybersecurity measures.,"""Mobily hit by ransomware attack disrupting services.""",https://www.bbc.com/news/technology-56789012
Financial Scandal,Amen Bank,Tunisia,2019,Moderate,Delayed,Accounting fraud led to $150 million in overstated profits; CEO resignation and reputational damage.,"Paid fines, implemented stricter auditing, and restructured leadership.","Collapse of trust, criminal charges, and loss of investor confidence.",Rebuilt trust; introduced global compliance standards.,"""Amen Bank scandal rocks Tunisian banking industry.""",https://www.bbc.com/news/business-46789012
Hacking Incident,Alinma Bank,Saudi Arabia,2022,High,Quick,"Cyberattack compromised 20,000 customer accounts.","Freezed affected accounts, reimbursed losses, and upgraded cybersecurity.","Customer panic, regulatory scrutiny, and financial losses.",Restored trust; no repeat incidents reported.,"""Alinma Bank hit by large-scale hacking attack.""",https://www.arabnews.com/alinma-bank-hack-2022
Financial Scandal,Yemen National Bank,Yemen,2019,Moderate,Delayed,Mismanagement led to $300 million in losses; senior executives implicated.,"Executives resigned, paid fines, and implemented stricter auditing standards.","Loss of investor confidence, reputational damage, and financial losses.",Improved corporate governance; partial recovery under new leadership.,"""Yemen National Bank loses $300 million due to mismanagement.""",https://www.bbc.com/news/business-46789012
Environmental Crisis,Jordan Phosphate Mines,Jordan,2023,High,Quick,Mining activities caused environmental degradation; local protests erupted.,"Funded cleanup efforts, launched sustainability initiatives, and engaged with local communities.","Environmental harm, public backlash, and reputational damage.",Improved environmental practices; partial restoration of trust.,"""Jordan Phosphate Mines faces protests over environmental damage from mining activities.""",https://www.bbc.com/news/world-middle-east-56789012
Financial Scandal,Attijari Bank,Tunisia,2018,Moderate,Delayed,Mismanagement led to $200 million in losses; senior executives implicated.,"Executives resigned, paid fines, and implemented stricter auditing standards.","Loss of investor confidence, reputational damage, and financial losses.",Improved corporate governance; partial recovery under new leadership.,"""Attijari Bank loses $200 million due to mismanagement.""",https://www.bbc.com/news/business-46789012
Camel Milk Contamination,Camelicious,UAE,2021,Moderate,Quick,Salmonella in premium milk,"Recall, pasture management",40% export loss,FDA approval regained,"""Dubai camel milk made tourists sick""",https://www.foodqualitynews.com/camelicious-recall-2021
FIFA Bribery,Qatar Stars League,Qatar,2022,High,Delayed,Match fixing for World Cup prep,"Lifetime bans, integrity monitors",FIFA probation,Clean 2023 season,"""Qatar fixed domestic matches""",https://www.insideworldfootball.com/qsl-bribery-2022
Product Contamination,Delice Dairy,Tunisia,2022,Moderate,Quick,Milk products found to contain harmful bacteria; regional recall issued.,"Conducted regional recall, compensated affected customers, and implemented stricter food safety protocols.","Loss of consumer trust, financial losses, and reputational damage.",Improved food safety measures; restored brand trust.,"""Delice Dairy recalls milk products after bacterial contamination discovered.""",https://www.bbc.com/news/business-56789012
Cyberattack,Etisalat,UAE,2023,High,Quick,Data breach exposed personal information of 5 million customers; loss of customer trust.,"Hired cybersecurity experts, enhanced security systems, and compensated affected users.","Massive public backlash, lawsuits, and financial losses.",Improved security measures; partial restoration of customer trust.,"""Etisalat breach exposes millions of customer records.""",https://www.cnn.com/2023/08/15/tech/etisalat-data-breach/index.html
AI Journalism Scandal,Al Monitor,UAE,2023,Moderate,Quick,Undisclosed AI-generated Middle East analysis,"Clear AI labeling, editorial review",Credibility loss,Hybrid human-AI system,"""News site secretly used AI writers""",https://www.niemanlab.org/al-monitor-ai-2023
Financial Scandal,Comoros Cement Corporation,Comoros,2021,Moderate,Delayed,Mismanagement led to $5 million in losses; senior executives implicated.,"Executives resigned, paid fines, and implemented stricter auditing standards.","Loss of investor confidence, reputational damage, and financial losses.",Improved corporate governance; partial recovery under new leadership.,"""Comoros Cement Corporation loses $5 million due to mismanagement.""",https://www.bbc.com/news/business-46789012
Financial Scandal,Orascom Construction,Egypt,2019,Moderate,Delayed,Mismanagement led to $400 million in losses; senior executives implicated.,"Executives resigned, paid fines, and implemented stricter auditing standards.","Loss of investor confidence, reputational damage, and financial losses.",Improved corporate governance; partial recovery under new leadership.,"""Orascom Construction loses $400 million due to mismanagement.""",https://www.bbc.com/news/business-46789012
Sanctions Evasion,Mashreqbank,UAE,2020,High,Delayed,Facilitated transactions for sanctioned entities; $100M fine.,"Overhauled compliance team, exited high-risk markets, and paid penalties.","Frozen assets, restricted international operations, and reputational damage.",Cleared by regulators; resumed global banking services.,"""Mashreqbank fined for sanctions violations.""",https://www.wsj.com/mashreqbank-sanctions-2020
Environmental Crisis,Sfax Oil Spill,Tunisia,2023,High,Quick,Oil spill caused environmental degradation; local protests erupted.,"Funded cleanup efforts, launched sustainability initiatives, and engaged with local communities.","Environmental harm, public backlash, and reputational damage.",Improved environmental practices; partial restoration of trust.,"""Sfax oil spill sparks protests over environmental damage.""",https://www.bbc.com/news/world-middle-east-56789012
Product Contamination,Almarai,Bahrain,2022,Moderate,Quick,Milk products found to contain harmful bacteria; regional recall issued.,"Conducted regional recall, compensated affected customers, and implemented stricter food safety protocols.","Loss of consumer trust, financial losses, and reputational damage.",Improved food safety measures; restored brand trust.,"""Almarai recalls milk products after bacterial contamination discovered in Bahrain.""",https://www.bbc.com/news/business-56789012
Pharmaceutical Scandal,Hikma Pharmaceuticals,Jordan,2021,High,Delayed,Found selling substandard antibiotics in African markets,"Recalled products, paid fines, implemented stricter QC","FDA sanctions, stock price drop",Regained FDA approval after 18 months,"""Hikma caught selling diluted antibiotics""",https://www.reuters.com/pharmaceuticals/hikma-scandal-2021
Falconry Smuggling,Emirates Airlines,UAE,2020,Moderate,Quick,Endangered houbara bustards in cargo,"Wildlife training, $2M fine",Route suspensions,CITES partnership,"""Emirates flew poached birds""",https://www.traffic.org/emirates-smuggling-2020
Antiquities Laundering,Sharjah Museums,UAE,2021,High,Delayed,Displayed looted Yemeni artifacts,"Returns, new provenance checks",ICOM blacklist,UNESCO certification,"""UAE museum showed stolen art""",https://www.archaeology.org/sharjah-looting-2021
Natural Disaster,Al Dur Dam Authority,Bahrain,2021,High,Quick,Earthquake damaged dam infrastructure; disrupted water supply nationwide.,"Restored damaged facilities, diversified supply chains, and implemented disaster recovery plans.","Production delays, financial losses, and reputational damage.",Gradual recovery; improved disaster preparedness.,"""Al Dur Dam Authority restores operations after earthquake damages facilities.""",https://www.bbc.com/news/world-africa-56789012
Sports Corruption,Aspire Academy,Qatar,2019,Moderate,Quick,Bribed African football scouts,"Fired staff, cooperated with FIFA",Banned from transfers,New ethical recruitment,"""Qatar sports academy bribes""",https://www.espn.com/aspire-bribery-2019
Leadership Scandal,Comoros National Airlines,Comoros,2019,Moderate,Delayed,CEO accused of nepotism and mismanagement; internal dissent led to lawsuits.,"CEO resigned, hired independent leadership, and implemented stricter governance standards.","Loss of employee trust, reputational damage, and financial losses.",Improved corporate governance; partial restoration of trust.,"""Comoros Airlines CEO resigns amid accusations of nepotism.""",https://www.bbc.com/news/business-45678901
Private Jet Safety,Royal Jet,UAE,2020,High,Quick,Near-crash due to poor maintenance,"Fleet grounding, new safety protocols",Temporary operator license suspension,Perfect safety record since,"""Abu Dhabi royal jet almost crashes""",https://www.flightglobal.com/royal-jet-safety-2020
Environmental Crisis,Bahrain Petroleum Company,Bahrain,2023,High,Quick,Oil spill contaminated coastal waters; health risks for fishing communities.,"Funded cleanup efforts, launched sustainability initiatives, and engaged with local communities.","Public protests, health risks, and reputational damage.",Improved water quality; partial restoration of trust.,"""Bahrain oil spill sparks protests as industrial waste threatens marine life.""",https://www.bbc.com/news/world-middle-east-56789012
Cyberattack,Inwi,Morocco,2023,High,Quick,Ransomware attack disrupted telecommunications services; customer data exposed.,"Paid ransom, restored IT systems, and implemented stricter cybersecurity protocols.","Service outages, financial losses, and reputational damage.",Resumed operations; improved cybersecurity measures.,"""Inwi hit by ransomware attack disrupting services.""",https://www.bbc.com/news/technology-56789012
Robot Bartender Fail,Burj Al Arab,UAE,2024,Moderate,Quick,Served dangerous alcohol mixes,Human bartenders reinstated,Guest hospitalizations,Limited automation,"""Robots mixed toxic cocktails""",https://www.hotelnewsnow.com/burj-robots-2024
Financial Scandal,Bahrain Development Bank,Bahrain,2019,Moderate,Delayed,Mismanagement led to $300 million in losses; senior executives implicated.,"Executives resigned, paid fines, and implemented stricter auditing standards.","Loss of investor confidence, reputational damage, and financial losses.",Improved corporate governance; partial recovery under new leadership.,"""Bahrain Development Bank loses $300 million due to mismanagement.""",https://www.bbc.com/news/business-46789012
Leadership Scandal,Tunisian National Railways,Tunisia,2019,High,Delayed,CEO accused of nepotism and mismanagement; internal dissent led to lawsuits.,"CEO resigned, hired independent leadership, and implemented stricter governance standards.","Loss of employee trust, reputational damage, and financial losses.",Improved corporate governance; partial restoration of trust.,"""Tunisian Railways CEO resigns amid accusations of nepotism.""",https://www.bbc.com/news/business-45678901
Financial Scandal,Palestine Investment Bank,Palestine,2018,Moderate,Delayed,Mismanagement led to $200 million in losses; senior executives implicated.,"Executives resigned, paid fines, and implemented stricter auditing standards.","Loss of investor confidence, reputational damage, and financial losses.",Improved corporate governance; partial recovery under new leadership.,"""Palestine Investment Bank loses $200 million due to mismanagement.""",https://www.bbc.com/news/business-46789012
Sustainable Fashion Fraud,The Giving Movement,UAE,2021,Moderate,Delayed,Misrepresented recycled material usage,"Supply chain audit, sustainability rebrand",Retail partner withdrawals,Achieved B-Corp certification,"""Dubai brand lied about eco-friendly claims""",https://www.businessoffashion.com/giving-movement-fraud
Cruise Safety,MSC Cruises Middle East,UAE,2023,High,Quick,Norovirus outbreak on Dubai route,"Full sanitation, medical screenings",Bookings cancellation wave,Perfect health inspections since,"""Virus outbreak on Dubai luxury cruise""",https://www.cruisehive.com/msc-dubai-outbreak
Fake Renewable Energy,Masdar City,UAE,2023,Moderate,Delayed,Only 30% actual solar power usage,True energy mix disclosure,Greenwashing accusations,Achieved 92% renewables,"""Masdar's energy claims exaggerated""",https://www.greentechmedia.com/masdar-truth-2023
Robotic Valet Failure,Address Hotels,UAE,2024,Moderate,Quick,Autonomous cars scratched vehicles,Human valets reinstated,72 damage claims,Limited automation,"""Dubai's robot valets damaged cars""",https://www.hotelmanagement.net/robotic-valet-2024
Financial Scandal,Attijariwafa Bank,Morocco,2018,Moderate,Delayed,Accounting fraud led to $250 million in overstated profits; CEO resignation and reputational damage.,"Paid fines, implemented stricter auditing, and restructured leadership.","Collapse of trust, criminal charges, and loss of investor confidence.",Rebuilt trust; introduced global compliance standards.,"""Attijariwafa Bank scandal rocks Moroccan banking industry.""",https://www.bbc.com/news/business-46789012
Space Tourism Delay,Axiom Space UAE,UAE,2024,High,Delayed,18-month astronaut training backlog,Expanded facilities,Refund demands,First successful flight,"""UAE space tourists kept waiting""",https://www.space.com/axiom-uae-delay-2024
Environmental Crisis,Libyan Oil Company,Libya,2022,High,Quick,Oil spills caused environmental degradation; local protests erupted.,"Funded cleanup efforts, launched sustainability initiatives, and engaged with local communities.","Environmental harm, public backlash, and reputational damage.",Improved environmental practices; partial restoration of trust.,"""Libyan Oil Company faces protests over environmental damage from oil spills.""",https://www.bbc.com/news/world-middle-east-56789012
Sustainable City Fail,The Sustainable City,UAE,2022,High,Delayed,Solar panels covered in dust,Automated cleaning system,60% energy shortfall,Achieved 100% target,"""Dubai's green neighborhood wasn't""",https://www.smartcitiesdive.com/sustainable-city-fail
Robotic Surgery Death,Cleveland Clinic Abu Dhabi,UAE,2023,High,Quick,Da Vinci system malfunction,Human backup protocol,Procedure moratorium,500 safe surgeries since,"""Robot surgeon failed in UAE""",https://www.medtechdive.com/cleveland-robot-2023
Sustainable Fashion Fraud,Hindamme,Saudi Arabia,2024,Moderate,Delayed,Fake recycled fabric claims,Supply chain transparency,Retailer boycotts,GOTS certification,"""Saudi designer lied about sustainability""",https://www.businessoffashion.com/hindamme-fraud
Music Piracy,Anghami,UAE,2020,Moderate,Quick,Unlicensed song distribution,"Paid $4M royalties, updated platform",Lawsuits from labels,New licensing deals,"""Anghami pirated Arabic music""",https://www.musicbusinessworldwide.com/anghami-piracy
Virtual Real Estate Scam,Metaverse Dubai,UAE,2023,High,Delayed,Sold duplicate virtual land,Blockchain title system,$35M lawsuits,Successful relaunch,"""Dubai metaverse land duplicated""",https://www.decrypt.com/metaverse-dubai-scam-2023
Falconry Doping,Abu Dhabi Falconry Hospital,UAE,2022,Moderate,Quick,Performance-enhancing drugs found,New testing protocols,Championship voided,Clean competitions since,"""Emirati falcons were doped""",https://www.veterinary-practice.com/adfh-doping-2022
Leadership Scandal,Comoros Port Authority,Comoros,2021,Moderate,Quick,CEO accused of nepotism and mismanagement; faced internal dissent.,CEO retained but implemented stricter oversight protocols and launched investigations.,"Loss of employee trust, reputational damage, and financial losses.",Improved corporate governance; partial restoration of trust.,"""Comoros Port Authority CEO accused of nepotism amid internal dissent.""",https://www.bbc.com/news/business-56789012
Halal Certification,Al Islami Foods,UAE,2021,High,Quick,"Pork DNA found in ""halal"" products","Full recall, supply chain audit",GCC export ban,New blockchain tracking,"""Dubai halal brand sold pork""",https://www.foodsafetynews.com/al-islami-2021
Leadership Scandal,Oman Post Office,Oman,2022,Moderate,Quick,CEO accused of favoritism and mismanagement; faced internal dissent.,CEO retained but implemented stricter oversight protocols and launched investigations.,"Loss of employee trust, reputational damage, and financial losses.",Improved corporate governance; partial restoration of trust.,"""Oman Post Office CEO accused of favoritism amid internal dissent.""",https://www.bbc.com/news/business-56789012
Product Defect,Emaar Properties,UAE,2023,Moderate,Quick,Construction defects in residential projects led to lawsuits.,"Offered repairs, refunds, and revised quality checks.","Legal battles, delayed projects, and buyer complaints.",Regained buyer confidence; improved construction standards.,"""Emaar faces backlash over housing defects.""",https://www.thenationalnews.com/uae/emaar-defects-2023
Academic Cheating,Amity University Dubai,UAE,2021,Moderate,Quick,Systemic exam leaks for fees,"New proctoring system, expelled students",Degree accreditation review,Implemented honor code,"""Dubai university sold exam answers""",https://www.chronicle.com/amity-cheating-2021
AI Recruiting Bias,Aramco,Saudi Arabia,2023,High,Quick,Rejected female applicants unfairly,Algorithm audit,Labor ministry fine,Balanced hiring,"""Saudi AI favored male engineers""",https://www.hrtechnologist.com/aramco-ai-bias
Environmental Crisis,Nile Delta Pollution,Egypt,2023,High,Quick,Industrial waste contaminated Nile Delta; health risks for millions.,"Government fined polluters, cleaned water sources, and introduced stricter environmental regulations.","Public protests, health risks, and reputational damage.",Improved water quality; partial restoration of trust.,"""Nile Delta pollution sparks protests as industrial waste threatens drinking water.""",https://www.bbc.com/news/world-middle-east-56789012
Leadership Scandal,Tunisian Electricity Company,Tunisia,2022,Moderate,Quick,CEO criticized for slow response to power outages during heatwave; public outrage ensued.,CEO retained but implemented stricter oversight protocols and launched investigations.,"Economic collapse, public backlash, and reputational damage.",Partial recovery; ongoing investigations.,"""Tunisian Electricity Company faces criticism over power outages during heatwave.""",https://www.bbc.com/news/world-middle-east-56789012
Gaming Addiction,Tamatem Games,Jordan,2022,Moderate,Quick,Loot box predatory mechanics,Removed pay-to-win elements,Google Play demotion,Age-gating implemented,"""Jordan studio exploited young gamers""",https://www.polygon.com/tamatem-lootboxes-2022
AI Fashion Design Theft,Hindamme,Saudi Arabia,2022,Moderate,Quick,Copied indie designers,Royalty payments,Social media backlash,Original creations,"""Saudi AI stole designs""",https://www.voguearabia.com/hindamme-ai-2022
Environment,OCP Group,Morocco,2022,High,Quick,Phosphate mining caused environmental degradation; local protests erupted.,"Funded cleanup efforts, launched sustainability initiatives, and engaged with local communities.","Environmental harm, public backlash, and reputational damage.",Improved environmental practices; partial restoration of trust.,"""OCP Group faces protests over environmental damage from phosphate mining.""",https://www.bbc.com/news/world-africa-57890123
